{"$schema":"https://json-schema.org/draft/2020-12/schema","$id":"https://superconscious.dev/schemas/m1-5/attribution-graph.v1.json","title":"M1.5 Attribution Graph Certificate","description":"Edge-level causal evidence for a feature's downstream effects. The manifest/latent split is structurally committed: manifest claims are hashed separately from latent state.","type":"object","additionalProperties":false,"required":["schema_version","certificate_kind","generated_at","parent_m1c_causal_triad_id","graph_identity","construction_method","edges","graph_manifest_digest","graph_full_digest","implementability_assessment","execution_status","signing_authority","counterfactuals_addressable","non_claims","ledger_entry"],"properties":{"schema_version":{"const":"1.0.0"},"certificate_kind":{"const":"m1-5-attribution-graph"},"generated_at":{"type":"string","format":"date-time"},"parent_m1c_causal_triad_id":{"type":"string"},"graph_identity":{"type":"object","additionalProperties":false,"required":["graph_id","feature_ref","model_ref","prompt_ref"],"properties":{"graph_id":{"type":"string"},"feature_ref":{"type":"object","additionalProperties":false,"required":["sae_subpath","feature_index"],"properties":{"sae_subpath":{"type":"string"},"feature_index":{"type":"integer","minimum":0}}},"model_ref":{"type":"object","additionalProperties":false,"required":["model_id","content_sha256"],"properties":{"model_id":{"type":"string"},"content_sha256":{"$ref":"#/$defs/sha256"}}},"prompt_ref":{"type":"object","additionalProperties":false,"required":["prompt_id","content_sha256"],"properties":{"prompt_id":{"type":"string"},"content_sha256":{"$ref":"#/$defs/sha256"}}}}},"construction_method":{"type":"object","additionalProperties":false,"required":["method_name","method_version","configuration"],"properties":{"method_name":{"type":"string","enum":["attribution_patching","integrated_gradients","activation_patching","causal_scrubbing","edge_attribution_patching","sparse_feature_circuit"]},"method_version":{"type":"string"},"configuration":{"type":"object"},"rng_seed":{"oneOf":[{"type":"integer"},{"type":"null"}]}}},"edges":{"type":"array","minItems":1,"items":{"$ref":"#/$defs/edge_claim"}},"graph_manifest_digest":{"$ref":"#/$defs/sha256"},"graph_full_digest":{"$ref":"#/$defs/sha256"},"replay_verification":{"oneOf":[{"type":"object","additionalProperties":false,"required":["replay_state","verifier_authority","verified_at"],"properties":{"replay_state":{"type":"string","enum":["bit_exact_replay","manifest_matches_latent_diverges","manifest_diverges"]},"verifier_authority":{"type":"string"},"verified_at":{"type":"string","format":"date-time"},"divergent_edges":{"type":"array","items":{"type":"string"}}}},{"type":"null"}]},"implementability_assessment":{"type":"object","additionalProperties":false,"required":["assessment","n_hidden_attribution_count","g_claimed_count","p_uncontrolled_model_count"],"properties":{"assessment":{"type":"string","enum":["implementable","impossible_prohibits_unavoidable_behavior","unsound_permits_unproducible_behavior","indeterminate"]},"n_hidden_attribution_count":{"type":"integer","minimum":0},"g_claimed_count":{"type":"integer","minimum":0},"p_uncontrolled_model_count":{"type":"integer","minimum":0}}},"execution_status":{"type":"string","enum":["doctrine_only","synthetic_fixture","runtime_executed","runtime_partial"]},"signing_authority":{"$ref":"#/$defs/signing_authority"},"counterfactuals_addressable":{"$ref":"#/$defs/counterfactuals_addressable"},"non_claims":{"type":"array","minItems":1,"items":{"type":"string"}},"ledger_entry":{"$ref":"#/$defs/ledger_entry"}},"$defs":{"sha256":{"type":"string","pattern":"^[a-f0-9]{64}$"},"signing_authority":{"type":"object","additionalProperties":false,"required":["authority_id","authority_kind","signed_at","signing_method"],"properties":{"authority_id":{"type":"string"},"authority_kind":{"type":"string","enum":["individual","automated_pipeline","role","delegated","external_auditor"]},"signed_at":{"type":"string","format":"date-time"},"signing_method":{"type":"string","enum":["sha256_content_hash","gpg_signature","sigstore","x509","internal_hmac"]},"delegation_chain":{"type":"array","items":{"type":"string"}}}},"counterfactuals_addressable":{"type":"array","minItems":1,"items":{"type":"object","additionalProperties":false,"required":["question_id","question","evidence_path","answer_form","answered_by_synthetic_fixture"],"properties":{"question_id":{"type":"string","pattern":"^cf-[a-z0-9-]+$"},"question":{"type":"string"},"evidence_path":{"type":"string"},"answer_form":{"type":"string","enum":["boolean","hash_match","numerical_range","categorical","structured"]},"answered_by_synthetic_fixture":{"type":"boolean"}}}},"ledger_entry":{"type":"object","additionalProperties":false,"required":["ledger_id","supersedes","promotion_status"],"properties":{"ledger_id":{"type":"string"},"supersedes":{"type":["string","null"]},"promotion_status":{"type":"string"}}},"edge_claim":{"type":"object","additionalProperties":false,"required":["edge_id","manifest","latent","manifest_digest","full_digest"],"properties":{"edge_id":{"type":"string"},"manifest":{"type":"object","additionalProperties":false,"required":["source","target","kind","weight"],"properties":{"source":{"$ref":"#/$defs/node_ref"},"target":{"$ref":"#/$defs/node_ref"},"kind":{"type":"string","enum":["attribution_score","direct_path","indirect_path","qk_attribution","ov_attribution"]},"weight":{"type":"number"}}},"latent":{"type":"object","additionalProperties":false,"properties":{"patching_trajectory":{"type":"array","items":{"type":"number"}},"scrubbing_residual":{"oneOf":[{"type":"number"},{"type":"null"}]},"replications":{"type":"integer","minimum":1}}},"manifest_digest":{"$ref":"#/$defs/sha256"},"full_digest":{"$ref":"#/$defs/sha256"}}},"node_ref":{"type":"object","additionalProperties":false,"required":["node_kind","node_id"],"properties":{"node_kind":{"type":"string","enum":["sae_feature","attention_head","mlp_neuron","residual_stream","logit","embedding"]},"node_id":{"type":"string"},"layer":{"type":"integer"}}}}}
