{"schema_version":"1.0.0","certificate_kind":"m1-5-attribution-graph","generated_at":"2026-05-12T00:00:00Z","parent_m1c_causal_triad_id":"m1c-feature-12345","graph_identity":{"graph_id":"m1-5-feature-12345-graph-equal-digests","feature_ref":{"sae_subpath":"layer_20/width_131k/average_l0_81","feature_index":12345},"model_ref":{"model_id":"google/gemma-2-9b-it","content_sha256":"e5f6a1b2c3d4e5f6a1b2c3d4e5f6a1b2c3d4e5f6a1b2c3d4e5f6a1b2c3d4e5f6"},"prompt_ref":{"prompt_id":"prompt-001","content_sha256":"1234567890abcdef1234567890abcdef1234567890abcdef1234567890abcdef"}},"construction_method":{"method_name":"attribution_patching","method_version":"1.0","configuration":{"steps":20,"baseline":"zero"},"rng_seed":42},"edges":[{"edge_id":"edge-001","manifest":{"source":{"node_kind":"sae_feature","node_id":"feat-12345","layer":20},"target":{"node_kind":"attention_head","node_id":"L25.H7","layer":25},"kind":"attribution_score","weight":0.847},"latent":{"patching_trajectory":[0.0,0.12,0.34],"scrubbing_residual":0.023,"replications":5},"manifest_digest":"aaaaaaaaaaaaaaaaaaaaaaaaaaaaaaaaaaaaaaaaaaaaaaaaaaaaaaaaaaaaaaaa","full_digest":"bbbbbbbbbbbbbbbbbbbbbbbbbbbbbbbbbbbbbbbbbbbbbbbbbbbbbbbbbbbbbbbb"}],"graph_manifest_digest":"eeeeeeeeeeeeeeeeeeeeeeeeeeeeeeeeeeeeeeeeeeeeeeeeeeeeeeeeeeeeeeee","graph_full_digest":"eeeeeeeeeeeeeeeeeeeeeeeeeeeeeeeeeeeeeeeeeeeeeeeeeeeeeeeeeeeeeeee","replay_verification":{"replay_state":"bit_exact_replay","verifier_authority":"socioprophet-independent-reviewer","verified_at":"2026-05-12T01:00:00Z","divergent_edges":[]},"implementability_assessment":{"assessment":"implementable","n_hidden_attribution_count":1,"g_claimed_count":1,"p_uncontrolled_model_count":1024},"execution_status":"synthetic_fixture","signing_authority":{"authority_id":"socioprophet-superconscious-pilot-team","authority_kind":"role","signed_at":"2026-05-12T00:00:00Z","signing_method":"sha256_content_hash"},"counterfactuals_addressable":[{"question_id":"cf-edge-causal-strength","question":"What is the causal strength of each claimed edge?","evidence_path":"/edges","answer_form":"structured","answered_by_synthetic_fixture":true}],"non_claims":["Equal graph digests are reserved for semantic validator failure."],"ledger_entry":{"ledger_id":"m1-5-synthetic-equal-digests-001","supersedes":null,"promotion_status":"synthetic_fixture_demonstration"}}
